{
  "$schema": "https://json-schema.org/draft/2020-12/schema",
  "$id": "https://lightyear.example/schema/jcl-compatibility-ledger.schema.json",
  "title": "LIGHTYEAR JCL compatibility ledger",
  "type": "object",
  "required": ["schema_version", "ledger_type", "graph_content_sha256", "classifications", "entries", "statistics", "qualification_blocked", "mainframe_equivalent", "production_ready", "content_sha256"],
  "properties": {
    "schema_version": {"const": "1.0"},
    "ledger_type": {"const": "lightyear-jcl-compatibility-ledger"},
    "graph_content_sha256": {"type": "string", "pattern": "^[0-9a-f]{64}$"},
    "classifications": {"type": "array", "minItems": 5, "maxItems": 5, "uniqueItems": true},
    "entries": {"type": "array", "minItems": 22, "maxItems": 22},
    "statistics": {"type": "object"},
    "qualification_blocked": {"const": true},
    "mainframe_equivalent": {"const": false},
    "production_ready": {"const": false},
    "content_sha256": {"type": "string", "pattern": "^[0-9a-f]{64}$"}
  },
  "additionalProperties": false
}
