{
  "classifications": [
    "exact",
    "normalized-equivalent",
    "policy-decision-required",
    "lossy",
    "unsupported"
  ],
  "content_sha256": "063fcf290ba59c5386183d0a702933b2dd5f7dcd5374fc6d01fdc6a7fbd4dc59",
  "entries": [
    {
      "classification": "exact",
      "decision": "bounded-contract",
      "evidence_required": [
        "job-card-parse-cases"
      ],
      "item_id": "jcl:job-card-and-accounting",
      "rationale": "JCL syntax, installation policy, and runtime effects are governed independently; static parsing cannot establish JES, catalog, scheduler, or restart equivalence.",
      "scope": "job-card-and-accounting",
      "source_semantics": {
        "claim": "bounded-static-and-synthetic-evidence",
        "language": "IBM z/OS JCL"
      },
      "target_semantics": {
        "contract": "lightyear-jcl-qualification"
      }
    },
    {
      "classification": "policy-decision-required",
      "decision": "unresolved",
      "evidence_required": [
        "installation-policy-and-JES-baseline"
      ],
      "item_id": "jcl:job-class-message-and-notify-routing",
      "rationale": "JCL syntax, installation policy, and runtime effects are governed independently; static parsing cannot establish JES, catalog, scheduler, or restart equivalence.",
      "scope": "job-class-message-and-notify-routing",
      "source_semantics": {
        "claim": "bounded-static-and-synthetic-evidence",
        "language": "IBM z/OS JCL"
      },
      "target_semantics": {
        "contract": "lightyear-jcl-qualification"
      }
    },
    {
      "classification": "normalized-equivalent",
      "decision": "governed-normalization",
      "evidence_required": [
        "procedure-expansion-and-override-cases"
      ],
      "item_id": "jcl:cataloged-and-instream-procedures",
      "rationale": "JCL syntax, installation policy, and runtime effects are governed independently; static parsing cannot establish JES, catalog, scheduler, or restart equivalence.",
      "scope": "cataloged-and-instream-procedures",
      "source_semantics": {
        "claim": "bounded-static-and-synthetic-evidence",
        "language": "IBM z/OS JCL"
      },
      "target_semantics": {
        "contract": "lightyear-jcl-qualification"
      }
    },
    {
      "classification": "policy-decision-required",
      "decision": "unresolved",
      "evidence_required": [
        "substitution-order-and-system-symbol-baseline"
      ],
      "item_id": "jcl:symbolic-parameters-and-set",
      "rationale": "JCL syntax, installation policy, and runtime effects are governed independently; static parsing cannot establish JES, catalog, scheduler, or restart equivalence.",
      "scope": "symbolic-parameters-and-set",
      "source_semantics": {
        "claim": "bounded-static-and-synthetic-evidence",
        "language": "IBM z/OS JCL"
      },
      "target_semantics": {
        "contract": "lightyear-jcl-qualification"
      }
    },
    {
      "classification": "policy-decision-required",
      "decision": "unresolved",
      "evidence_required": [
        "exact-procedure-library-and-include-closure"
      ],
      "item_id": "jcl:include-and-jcllib-search-order",
      "rationale": "JCL syntax, installation policy, and runtime effects are governed independently; static parsing cannot establish JES, catalog, scheduler, or restart equivalence.",
      "scope": "include-and-jcllib-search-order",
      "source_semantics": {
        "claim": "bounded-static-and-synthetic-evidence",
        "language": "IBM z/OS JCL"
      },
      "target_semantics": {
        "contract": "lightyear-jcl-qualification"
      }
    },
    {
      "classification": "normalized-equivalent",
      "decision": "governed-normalization",
      "evidence_required": [
        "load-library-and-program-identity-evidence"
      ],
      "item_id": "jcl:exec-pgm-resolution",
      "rationale": "JCL syntax, installation policy, and runtime effects are governed independently; static parsing cannot establish JES, catalog, scheduler, or restart equivalence.",
      "scope": "exec-pgm-resolution",
      "source_semantics": {
        "claim": "bounded-static-and-synthetic-evidence",
        "language": "IBM z/OS JCL"
      },
      "target_semantics": {
        "contract": "lightyear-jcl-qualification"
      }
    },
    {
      "classification": "policy-decision-required",
      "decision": "unresolved",
      "evidence_required": [
        "cataloged-procedure-resolution-listing"
      ],
      "item_id": "jcl:exec-procedure-resolution",
      "rationale": "JCL syntax, installation policy, and runtime effects are governed independently; static parsing cannot establish JES, catalog, scheduler, or restart equivalence.",
      "scope": "exec-procedure-resolution",
      "source_semantics": {
        "claim": "bounded-static-and-synthetic-evidence",
        "language": "IBM z/OS JCL"
      },
      "target_semantics": {
        "contract": "lightyear-jcl-qualification"
      }
    },
    {
      "classification": "normalized-equivalent",
      "decision": "governed-normalization",
      "evidence_required": [
        "parameter-and-limit-vectors"
      ],
      "item_id": "jcl:parm-time-and-region",
      "rationale": "JCL syntax, installation policy, and runtime effects are governed independently; static parsing cannot establish JES, catalog, scheduler, or restart equivalence.",
      "scope": "parm-time-and-region",
      "source_semantics": {
        "claim": "bounded-static-and-synthetic-evidence",
        "language": "IBM z/OS JCL"
      },
      "target_semantics": {
        "contract": "lightyear-jcl-qualification"
      }
    },
    {
      "classification": "normalized-equivalent",
      "decision": "governed-normalization",
      "evidence_required": [
        "ordered-concatenation-and-override-cases"
      ],
      "item_id": "jcl:dd-name-and-concatenation",
      "rationale": "JCL syntax, installation policy, and runtime effects are governed independently; static parsing cannot establish JES, catalog, scheduler, or restart equivalence.",
      "scope": "dd-name-and-concatenation",
      "source_semantics": {
        "claim": "bounded-static-and-synthetic-evidence",
        "language": "IBM z/OS JCL"
      },
      "target_semantics": {
        "contract": "lightyear-jcl-qualification"
      }
    },
    {
      "classification": "normalized-equivalent",
      "decision": "governed-normalization",
      "evidence_required": [
        "dataset-identity-and-lifetime-cases"
      ],
      "item_id": "jcl:dsn-and-temporary-datasets",
      "rationale": "JCL syntax, installation policy, and runtime effects are governed independently; static parsing cannot establish JES, catalog, scheduler, or restart equivalence.",
      "scope": "dsn-and-temporary-datasets",
      "source_semantics": {
        "claim": "bounded-static-and-synthetic-evidence",
        "language": "IBM z/OS JCL"
      },
      "target_semantics": {
        "contract": "lightyear-jcl-qualification"
      }
    },
    {
      "classification": "policy-decision-required",
      "decision": "unresolved",
      "evidence_required": [
        "normal-and-abnormal-termination-catalog-baseline"
      ],
      "item_id": "jcl:disposition-and-catalog-effects",
      "rationale": "JCL syntax, installation policy, and runtime effects are governed independently; static parsing cannot establish JES, catalog, scheduler, or restart equivalence.",
      "scope": "disposition-and-catalog-effects",
      "source_semantics": {
        "claim": "bounded-static-and-synthetic-evidence",
        "language": "IBM z/OS JCL"
      },
      "target_semantics": {
        "contract": "lightyear-jcl-qualification"
      }
    },
    {
      "classification": "policy-decision-required",
      "decision": "unresolved",
      "evidence_required": [
        "live-catalog-generation-baseline"
      ],
      "item_id": "jcl:gdg-resolution-and-rolloff",
      "rationale": "JCL syntax, installation policy, and runtime effects are governed independently; static parsing cannot establish JES, catalog, scheduler, or restart equivalence.",
      "scope": "gdg-resolution-and-rolloff",
      "source_semantics": {
        "claim": "bounded-static-and-synthetic-evidence",
        "language": "IBM z/OS JCL"
      },
      "target_semantics": {
        "contract": "lightyear-jcl-qualification"
      }
    },
    {
      "classification": "policy-decision-required",
      "decision": "unresolved",
      "evidence_required": [
        "catalog-SMS-and-open-time-resolution"
      ],
      "item_id": "jcl:dcb-record-layout-and-labels",
      "rationale": "JCL syntax, installation policy, and runtime effects are governed independently; static parsing cannot establish JES, catalog, scheduler, or restart equivalence.",
      "scope": "dcb-record-layout-and-labels",
      "source_semantics": {
        "claim": "bounded-static-and-synthetic-evidence",
        "language": "IBM z/OS JCL"
      },
      "target_semantics": {
        "contract": "lightyear-jcl-qualification"
      }
    },
    {
      "classification": "lossy",
      "decision": "accepted-only-in-bounded-planning",
      "evidence_required": [
        "storage-class-management-class-and-volume-policy"
      ],
      "item_id": "jcl:space-sms-and-volume-allocation",
      "rationale": "JCL syntax, installation policy, and runtime effects are governed independently; static parsing cannot establish JES, catalog, scheduler, or restart equivalence.",
      "scope": "space-sms-and-volume-allocation",
      "source_semantics": {
        "claim": "bounded-static-and-synthetic-evidence",
        "language": "IBM z/OS JCL"
      },
      "target_semantics": {
        "contract": "lightyear-jcl-qualification"
      }
    },
    {
      "classification": "normalized-equivalent",
      "decision": "governed-normalization",
      "evidence_required": [